Research_Topic_Num,Aligned_Policy_Topic_Num,Similarity_Score,Research_Topic_Label,Aligned_Policy_Topic_Label
618,5,0.5579452065578024,"Topic 618: alien, niche, alien bird, bird, alien range","Topic 5: waste, waste management, recycling, hazardous, disposal"
70,27,0.5561449060424496,"Topic 70: islands, island, sec jats, jats sec, sec","Topic 27: food, labelling, regulations, additives, packaged"
357,97,0.4656254344681198,"Topic 357: thermal, ants, ct jats, ct, ant","Topic 97: small, enterprises, fund, small medium, medium enterprises"
584,97,0.4648313944313536,"Topic 584: brain, brain size, guppies, cognitive, offspring","Topic 97: small, enterprises, fund, small medium, medium enterprises"
69,110,0.5755386845610847,"Topic 69: peatland, peatlands, peat, sphagnum, italic sphagnum","Topic 110: emergency, coronavirus covid, novel coronavirus, novel, coronavirus"
460,37,0.5417142549945485,"Topic 460: fungal, its2, fungi, case gh, content 63","Topic 37: heritage, aboriginal, cultural, cultural heritage, islander"
129,6,0.6478125939356411,"Topic 129: elevational, alpine, elevation, richness, species richness","Topic 6: plant, quarantine, plants, pests, phytosanitary"
290,28,0.3108970694331811,"Topic 290: cod, age, pikeperch, recruitment, atlantic cod","Topic 28: chemicals, dangerous, substances, dangerous goods, chemical"
369,97,0.3753015377102973,"Topic 369: river, rivers, mir, basin, reservoir","Topic 97: small, enterprises, fund, small medium, medium enterprises"
279,28,0.33592279963763205,"Topic 279: mitochondrial, shrimp, oxidase, subunit, cytochrome","Topic 28: chemicals, dangerous, substances, dangerous goods, chemical"
403,27,0.5040680393361532,"Topic 403: foraging, travel, food, group, bonobos","Topic 27: food, labelling, regulations, additives, packaged"
314,97,0.4334323127797864,"Topic 314: sec jats, jats sec, sec, jats title, title","Topic 97: small, enterprises, fund, small medium, medium enterprises"
436,23,0.4908033096969459,"Topic 436: epr, producer responsibility, responsibility, extended producer, producer","Topic 23: radiation, nuclear, radioactive, radioactive waste, ionising radiation"
579,27,0.5874812285154146,"Topic 579: isolates, mcc, cellulose, jeevamrut, jeevamrut medium","Topic 27: food, labelling, regulations, additives, packaged"
467,28,0.4894572073260509,"Topic 467: sequencing, minion, barcodes, case ion, ion jats","Topic 28: chemicals, dangerous, substances, dangerous goods, chemical"
559,44,0.4563009939119244,"Topic 559: snail, land snail, snails, shell, italic vertigo","Topic 44: virginia, chapter code, code virginia, commonwealth, chapter"
174,44,0.49787789112352676,"Topic 174: behaviours, accelerometer, devices, tags, device","Topic 44: virginia, chapter code, code virginia, commonwealth, chapter"
259,27,0.5120555537542049,"Topic 259: expression, stress, thermal, gene expression, heat","Topic 27: food, labelling, regulations, additives, packaged"
287,28,0.5368224986887342,"Topic 287: wolbachia, wolbachia jats, italic wolbachia, infected, host","Topic 28: chemicals, dangerous, substances, dangerous goods, chemical"
515,5,0.7560171903804981,"Topic 515: lice, feather, mite, feather mites, feather mite","Topic 5: waste, waste management, recycling, hazardous, disposal"
232,97,0.4810716209355495,"Topic 232: herbivore, herbivores, grass, savannas, savanna","Topic 97: small, enterprises, fund, small medium, medium enterprises"
594,59,0.41091112433846855,"Topic 594: fin, fins, tetrapods, hair cell, fin limb","Topic 59: cooperative, cooperatives, operatives, societies, members"
496,28,0.4695031247053112,"Topic 496: sex, sex reversal, reversal, chromosomes, sex chromosomes","Topic 28: chemicals, dangerous, substances, dangerous goods, chemical"
371,46,0.50764174680365,"Topic 371: patients, pain, lumbar, spine, bone","Topic 46: california, pest, agricultural code, california food, food agricultural"
235,115,0.36171234529485025,"Topic 235: barcoding, case dna, dna jats, barcode, styled content","Topic 115: planning development, planning, act 2000, 2000, development"
434,59,0.5003179376855738,"Topic 434: case aca, aca jats, text, articles, aca","Topic 59: cooperative, cooperatives, operatives, societies, members"
136,97,0.4395112484224709,"Topic 136: hybrid, discordance, introgression, lineages, hybrid zone","Topic 97: small, enterprises, fund, small medium, medium enterprises"
537,59,0.38378562394360716,"Topic 537: fgd, diversity, functional, abiotic, mean heterogeneity","Topic 59: cooperative, cooperatives, operatives, societies, members"
360,73,0.3332045253379388,"Topic 360: personality, animal personality, personality traits, behavioral, behavioural","Topic 73: model, animals, animal, entry union, consignments"
241,81,0.6325235113491654,"Topic 241: dispersal, wind, seed dispersal, seed, seeds","Topic 81: biosecurity, matter, organism, biosecurity matter, animal plant"
236,97,0.40899196104819463,"Topic 236: acidification, ph, ocean acidification, ocean, ph jats","Topic 97: small, enterprises, fund, small medium, medium enterprises"
322,28,0.44726691586831785,"Topic 322: domestication, maize, crop, wild, domesticated","Topic 28: chemicals, dangerous, substances, dangerous goods, chemical"
516,27,0.4110459002957735,"Topic 516: eagles, admissions, pens, bald, debrecen","Topic 27: food, labelling, regulations, additives, packaged"
464,97,0.334894566210987,"Topic 464: immune, pha, immune function, case pha, pha jats","Topic 97: small, enterprises, fund, small medium, medium enterprises"
83,20,0.3864780816751153,"Topic 83: flies, italic drosophila, drosophila, tolerance, thermal","Topic 20: climate, climate change, change, greenhouse, emissions"
572,97,0.3574173695373337,"Topic 572: mml, wind, migration, weather, radar","Topic 97: small, enterprises, fund, small medium, medium enterprises"
391,27,0.5432029489638424,"Topic 391: geese, goose, scaring, wintering, shooting","Topic 27: food, labelling, regulations, additives, packaged"
352,76,0.5226954528118974,"Topic 352: crayfish, astaci jats, astaci, italic astaci, crayfish plague","Topic 76: dakota, south dakota, district, south, chief engineer"
249,81,0.38344424321076076,"Topic 249: 3d, shape, landmark, morphometric, geometric","Topic 81: biosecurity, matter, organism, biosecurity matter, animal plant"
96,59,0.37033133475116864,"Topic 96: conservation, decision, planning, conservation planning, management","Topic 59: cooperative, cooperatives, operatives, societies, members"
663,27,0.38250094545245816,,"Topic 27: food, labelling, regulations, additives, packaged"
315,27,0.3405550286547865,"Topic 315: metal, copper, heavy, cu, metals","Topic 27: food, labelling, regulations, additives, packaged"
320,97,0.3886834128945335,"Topic 320: diet, dietary, metabarcoding, diets, dna metabarcoding","Topic 97: small, enterprises, fund, small medium, medium enterprises"
437,59,0.591143054386037,"Topic 437: case jats, jats styled, styled content, styled, content","Topic 59: cooperative, cooperatives, operatives, societies, members"
551,7,0.38975413353341076,"Topic 551: molt, feather, feathers, plumage, rictal","Topic 7: nutrition, agriculture, food, sector, food security"
312,28,0.35298741795398025,"Topic 312: fragmentation, habitat fragmentation, habitat, habitat loss, fragmentation jats","Topic 28: chemicals, dangerous, substances, dangerous goods, chemical"
475,28,0.4771021821616802,"Topic 475: polar, bears, ice, polar bears, sea ice","Topic 28: chemicals, dangerous, substances, dangerous goods, chemical"
286,21,0.4526340195625739,"Topic 286: meta, meta analyses, meta analysis, effect sizes, analyses","Topic 21: washington, rcw, code washington, washington rcw, chapter revised"
611,97,0.4842857925484202,"Topic 611: lynx, eurasian lynx, lynx jats, habitat selection, wild boars","Topic 97: small, enterprises, fund, small medium, medium enterprises"
112,62,0.508107454320428,"Topic 112: carbon, biomass, forest, forests, trees","Topic 62: antimicrobial, resistance, amr, antimicrobial resistance, antibiotic"
643,95,0.4626236597574872,"Topic 643: freshwater fish, aos, otolith, rita, taxonomic dissimilarity","Topic 95: health, care, ncds, strategic, health care"
539,7,0.45619298232795297,"Topic 539: extinction, metapopulation, patches, patch, colonization","Topic 7: nutrition, agriculture, food, sector, food security"
400,97,0.3484150305861787,"Topic 400: life expectancy, expectancy, mortality, sakha yakutia, sakha","Topic 97: small, enterprises, fund, small medium, medium enterprises"
276,59,0.4361700884637705,"Topic 276: epigenetic, methylation, epigenetic variation, dna methylation, genetic epigenetic","Topic 59: cooperative, cooperatives, operatives, societies, members"
510,97,0.49427012076749516,"Topic 510: herbicide, herbicides, seeding, activated carbon, hpps","Topic 97: small, enterprises, fund, small medium, medium enterprises"
321,31,0.4106305305480106,"Topic 321: parasite, parasites, host, hosts, trematode","Topic 31: port, ports, maritime, navigation, vessels"
263,27,0.365485165505702,"Topic 263: microbial, soil microbial, soil, microbial biomass, stoichiometry","Topic 27: food, labelling, regulations, additives, packaged"
632,62,0.6373634948755188,"Topic 632: ship, nfd, nis, ship types, vessel","Topic 62: antimicrobial, resistance, amr, antimicrobial resistance, antibiotic"
641,5,0.3930908105757132,"Topic 641: spectral diversity, spectral, vsc, vh, greenness","Topic 5: waste, waste management, recycling, hazardous, disposal"
642,28,0.44362709933251165,"Topic 642: wildcats, wildcat, hybridization, domestic cats, european wildcats","Topic 28: chemicals, dangerous, substances, dangerous goods, chemical"
185,27,0.41080680013827253,"Topic 185: whales, whale, dolphins, bottlenose, pacific","Topic 27: food, labelling, regulations, additives, packaged"
196,64,0.45406937357864097,"Topic 196: weed, ha, weeds, das, weed management","Topic 64: petroleum, gas, midstream, petroleum industry, petroleum products"
289,89,0.2735377499602793,"Topic 289: gases, gas, flue, dust, cleaning","Topic 89: information, access information, access, disclosure, right access"
562,82,0.44735232651827184,"Topic 562: common garden, garden, cyanogenic, fitness, selection","Topic 82: variety, plant, varieties, breeder, breeders"
266,1,0.3774162539465903,"Topic 266: addition, deposition, jats sup, sup, nitrogen","Topic 1: agricultural, export, marketing, products, meat"
480,75,0.4871900796562454,"Topic 480: antarctic, antarctica, sub antarctic, southern ocean, south","Topic 75: hunting, game, game hunting, game animals, hunting licence"
603,28,0.5718239619501505,"Topic 603: coatings, threads, antibacterial, prostheses, surgical","Topic 28: chemicals, dangerous, substances, dangerous goods, chemical"
306,97,0.37219632618888193,"Topic 306: genetic, genetic structure, genetic diversity, gene flow, forest","Topic 97: small, enterprises, fund, small medium, medium enterprises"
583,89,0.27976448488898314,"Topic 583: drive, gene drive, drives, gene drives, suppression","Topic 89: information, access information, access, disclosure, right access"
66,27,0.5591930549451306,"Topic 66: queens, queen, workers, social, caste","Topic 27: food, labelling, regulations, additives, packaged"
217,59,0.6543119974886542,"Topic 217: irrigation, water, groundwater, farmers, micro irrigation","Topic 59: cooperative, cooperatives, operatives, societies, members"
523,59,0.3809001747054558,"Topic 523: squirrels, natal dispersal, natal, flying squirrels, survival","Topic 59: cooperative, cooperatives, operatives, societies, members"
381,27,0.34246789075244854,"Topic 381: mortality, tree, growth, tree growth, forest","Topic 27: food, labelling, regulations, additives, packaged"
201,5,0.42397176847016105,"Topic 201: marsh, salt, salt marsh, marshes, alterniflora jats","Topic 5: waste, waste management, recycling, hazardous, disposal"
489,37,0.5025655120608665,"Topic 489: mammals, small mammal, mammal, small mammals, small","Topic 37: heritage, aboriginal, cultural, cultural heritage, islander"
435,97,0.3400148800946364,"Topic 435: scavenging, scavengers, carrion, scavenger, carcasses","Topic 97: small, enterprises, fund, small medium, medium enterprises"
526,92,0.21846943873020425,"Topic 526: covid 19, covid, pandemic, 19, youth","Topic 92: europe, social, crisis, cohesion, recovery"
585,27,0.366466770746468,"Topic 585: ant, myrmecochorous, dispersal, seed, diaspores","Topic 27: food, labelling, regulations, additives, packaged"
189,34,0.5435185804740282,"Topic 189: mental, alcohol, mental medicine, synergetic, disorders","Topic 34: agricultural, farmers, purpose act, rural, contribute"
281,82,0.2242064548901675,"Topic 281: oil, humic, contaminated, oil products, crude oil","Topic 82: variety, plant, varieties, breeder, breeders"
208,59,0.5165079672862205,"Topic 208: invasive, invasion, genetic, native, introduced","Topic 59: cooperative, cooperatives, operatives, societies, members"
139,28,0.5518612639847569,"Topic 139: oyster, reefs, oysters, reef, oyster reefs","Topic 28: chemicals, dangerous, substances, dangerous goods, chemical"
518,28,0.4662819379409198,"Topic 518: grouse, sage grouse, sage, prairie chicken, leks","Topic 28: chemicals, dangerous, substances, dangerous goods, chemical"
529,5,0.40752750650457265,"Topic 529: methylation, epigenetic, dna methylation, hatchery, epiradseq","Topic 5: waste, waste management, recycling, hazardous, disposal"
527,28,0.5422350970817769,"Topic 527: sponge, sponges, coral, italic ac, reefs","Topic 28: chemicals, dangerous, substances, dangerous goods, chemical"
646,8,0.5941634721942883,"Topic 646: methylation, dna methylation, dna, wide dna, epigenetic","Topic 8: land, registration, property, act, court"
405,28,0.4723871735258832,"Topic 405: microsatellite, microsatellites, genotyping, loci, markers","Topic 28: chemicals, dangerous, substances, dangerous goods, chemical"
633,59,0.3853891008418103,"Topic 633: case cwc, cwc jats, cwc, setosum, setosum jats","Topic 59: cooperative, cooperatives, operatives, societies, members"
334,5,0.4973812174391096,"Topic 334: elemental, stoichiometric, stoichiometry, phosphorus, ecological stoichiometry","Topic 5: waste, waste management, recycling, hazardous, disposal"
346,97,0.5551149303474672,"Topic 346: qtp, case qtp, qtp jats, chloroplast, glacial","Topic 97: small, enterprises, fund, small medium, medium enterprises"
267,7,0.5032543081558247,"Topic 267: metabarcoding, dna, pcr, tag, primers","Topic 7: nutrition, agriculture, food, sector, food security"
577,77,0.5581229539405613,"Topic 577: paleobiology, conservation paleobiology, conservation, geohistorical, uct","Topic 77: land, crown, lands, fence, crown lands"
100,20,0.6092981743066817,"Topic 100: anpp, drought, precipitation, stability, extreme drought","Topic 20: climate, climate change, change, greenhouse, emissions"
481,75,0.39570319369266066,"Topic 481: cognitive, task, solving, string, problem solving","Topic 75: hunting, game, game hunting, game animals, hunting licence"
499,59,0.4010940787748922,"Topic 499: han, kadai, tai kadai, tai, speaking","Topic 59: cooperative, cooperatives, operatives, societies, members"
226,27,0.40443216667373216,"Topic 226: glacier, microbial, permafrost, bacterial, soils","Topic 27: food, labelling, regulations, additives, packaged"
497,97,0.43743006143549734,"Topic 497: squirrels, squirrel, red squirrels, gray squirrel, italic sciurus","Topic 97: small, enterprises, fund, small medium, medium enterprises"
284,28,0.4642635434803671,"Topic 284: zooplankton, mesozooplankton, zooplankton community, copepod, copepods","Topic 28: chemicals, dangerous, substances, dangerous goods, chemical"
345,1,0.5243672488653601,"Topic 345: electric, charging, vehicle, vehicles, electricity","Topic 1: agricultural, export, marketing, products, meat"
268,28,0.39973828187873506,"Topic 268: biocrusts, biocrust, moss, cyanobacteria, dryland","Topic 28: chemicals, dangerous, substances, dangerous goods, chemical"
649,77,0.37346440766577055,"Topic 649: china, bowersi, bowersi jats, flavopunctatus jats, flavopunctatus","Topic 77: land, crown, lands, fence, crown lands"
193,37,0.4186614884692591,"Topic 193: education, students, environmental education, teaching, ecological culture","Topic 37: heritage, aboriginal, cultural, cultural heritage, islander"
301,11,0.3805996402315899,"Topic 301: pleistocene, glacial, late pleistocene, ancient, reindeer","Topic 11: protected, areas, protected areas, park, parks"
304,27,0.3599839420246834,"Topic 304: flowering, flowering time, selection, flc jats, flc","Topic 27: food, labelling, regulations, additives, packaged"
586,59,0.5432758531943572,"Topic 586: tadpoles, predators, metamorphosis, italic tadpoles, plasticity","Topic 59: cooperative, cooperatives, operatives, societies, members"
519,73,0.5689144255518921,"Topic 519: stereo, video, mpa, underwater, diver","Topic 73: model, animals, animal, entry union, consignments"
406,23,0.09163731708584136,"Topic 406: mating, male, males, female, mated","Topic 23: radiation, nuclear, radioactive, radioactive waste, ionising radiation"
652,108,0.3540948527882779,,"Topic 108: inserting, municipal, inserting section, regarding, mayor"
338,97,0.3304637726713538,"Topic 338: sperm, sperm competition, mating failure, paternity, mating","Topic 97: small, enterprises, fund, small medium, medium enterprises"
278,89,0.38616989324247675,"Topic 278: trout, trophic, lake, walleye, fish","Topic 89: information, access information, access, disclosure, right access"
442,5,0.36949395464959545,"Topic 442: rice, weedy, weedy rice, wr, cultivated rice","Topic 5: waste, waste management, recycling, hazardous, disposal"
272,27,0.43179270040733575,"Topic 272: antibiotic, args, resistance, antibiotic resistance, resistance genes","Topic 27: food, labelling, regulations, additives, packaged"
353,97,0.5290638509657218,"Topic 353: rice, bronze, archaeobotanical, bronze age, neolithic","Topic 97: small, enterprises, fund, small medium, medium enterprises"
319,82,0.274662926368127,"Topic 319: epiphyte, epiphytes, vascular, vascular epiphytes, epiphyte species","Topic 82: variety, plant, varieties, breeder, breeders"
183,37,0.5685751851561566,"Topic 183: penguins, penguin, breeding, adélie, antarctic","Topic 37: heritage, aboriginal, cultural, cultural heritage, islander"
260,27,0.38189534501448585,"Topic 260: cave, cavefish, subterranean, caves, surface","Topic 27: food, labelling, regulations, additives, packaged"
81,37,0.5673217218685777,"Topic 81: aposematic, coloration, warning, color, camouflage","Topic 37: heritage, aboriginal, cultural, cultural heritage, islander"
448,62,0.3128751180904146,"Topic 448: case mr, mr jats, case smr, smr jats, mr","Topic 62: antimicrobial, resistance, amr, antimicrobial resistance, antibiotic"
80,27,0.48378977864345746,"Topic 80: crop, crops, yield, weed, agricultural","Topic 27: food, labelling, regulations, additives, packaged"
560,28,0.38971756270639774,"Topic 560: seed predation, seed, predation, recruitment, seed head","Topic 28: chemicals, dangerous, substances, dangerous goods, chemical"
170,59,0.6066670748256329,"Topic 170: snps, adaptation, adaptive, genetic, climate","Topic 59: cooperative, cooperatives, operatives, societies, members"
362,97,0.5734157766534109,"Topic 362: acoustic telemetry, telemetry, acoustic, receiver, receivers","Topic 97: small, enterprises, fund, small medium, medium enterprises"
84,59,0.541423280452409,"Topic 84: mhc, case mhc, mhc jats, immune, tlr","Topic 59: cooperative, cooperatives, operatives, societies, members"
363,27,0.52447997237589,"Topic 363: rs, ha, farmer, farmers, returns","Topic 27: food, labelling, regulations, additives, packaged"
627,37,0.5790315907429052,"Topic 627: governance, actors, stakeholder, social learning, network governance","Topic 37: heritage, aboriginal, cultural, cultural heritage, islander"
631,123,0.4648290857668533,"Topic 631: predation, caterpillars, shelter, shelters, caterpillar","Topic 123: marine, designates area, instrument designates, described schedule, area described"
72,97,0.3960772063843834,"Topic 72: suitable, distribution, climate, suitable habitat, future","Topic 97: small, enterprises, fund, small medium, medium enterprises"
87,97,0.335668207692221,"Topic 87: extracts, extract, antioxidant, ml, activity","Topic 97: small, enterprises, fund, small medium, medium enterprises"
468,97,0.326005280473425,"Topic 468: wolf, wolves, attitudes, livestock, acceptance","Topic 97: small, enterprises, fund, small medium, medium enterprises"
118,59,0.5475762413607614,"Topic 118: genetic, genetic structure, structure, sea, population structure","Topic 59: cooperative, cooperatives, operatives, societies, members"
256,59,0.5552164430479496,"Topic 256: metals, heavy metals, heavy, soils, contamination","Topic 59: cooperative, cooperatives, operatives, societies, members"
184,27,0.41662817284456916,"Topic 184: gut, microbiota, microbiome, microbiomes, fish","Topic 27: food, labelling, regulations, additives, packaged"
387,97,0.4370896366045361,"Topic 387: burrowing, burrow, burrowing mammals, digging, mammals","Topic 97: small, enterprises, fund, small medium, medium enterprises"
214,5,0.3807846070473203,"Topic 214: phytoplankton, nutrient, phytoplankton community, light, cell","Topic 5: waste, waste management, recycling, hazardous, disposal"
253,27,0.5572161566783929,"Topic 253: plumage, coloration, tawny, morph, brown","Topic 27: food, labelling, regulations, additives, packaged"
124,5,0.39551871372614267,"Topic 124: concrete, cement, waste, materials, ceramic","Topic 5: waste, waste management, recycling, hazardous, disposal"
659,97,0.46643968071323244,,"Topic 97: small, enterprises, fund, small medium, medium enterprises"
389,28,0.2759285181665033,"Topic 389: mitogenome, mitogenomes, mitochondrial, pcgs, codon","Topic 28: chemicals, dangerous, substances, dangerous goods, chemical"
385,77,0.4261556738798771,"Topic 385: colony, colonies, ant, ants, polydomous","Topic 77: land, crown, lands, fence, crown lands"
137,59,0.49109246720225563,"Topic 137: liana, lianas, trees, tree, liana species","Topic 59: cooperative, cooperatives, operatives, societies, members"
318,97,0.2817006710872578,"Topic 318: genetic, spruce, picea, italic picea, china","Topic 97: small, enterprises, fund, small medium, medium enterprises"
207,5,0.5180314193261246,"Topic 207: assembly, community, phylogenetic, community assembly, communities","Topic 5: waste, waste management, recycling, hazardous, disposal"
374,27,0.3038856107897234,"Topic 374: students, anxiety, school, heart, information load","Topic 27: food, labelling, regulations, additives, packaged"
452,77,0.39572475585048933,"Topic 452: multifunctionality, functions, ecosystem, multiple functions, biodiversity","Topic 77: land, crown, lands, fence, crown lands"
478,27,0.5234520589542497,"Topic 478: urban, tree, street, trees, urban tree","Topic 27: food, labelling, regulations, additives, packaged"
303,27,0.36270219680710036,"Topic 303: mitochondrial, mitochondrial genome, genes, phylogenetic, pcgs","Topic 27: food, labelling, regulations, additives, packaged"
125,27,0.4276197807777095,"Topic 125: tick, ticks, lyme, burgdorferi, ixodes","Topic 27: food, labelling, regulations, additives, packaged"
421,28,0.532612782150099,"Topic 421: radio, localisation, tracking, tags, localization","Topic 28: chemicals, dangerous, substances, dangerous goods, chemical"
648,27,0.535765906173812,"Topic 648: mycobiota, soil, microbes, microbial, soil microbial","Topic 27: food, labelling, regulations, additives, packaged"
418,76,0.34708265529671223,"Topic 418: hibernation, torpor, hibernating, heat, mane","Topic 76: dakota, south dakota, district, south, chief engineer"
573,59,0.4767035949422318,"Topic 573: flegt, governance, rights, conservation, tiger","Topic 59: cooperative, cooperatives, operatives, societies, members"
473,27,0.45729037303119785,"Topic 473: dinoflagellates, dinoflagellate, ciliophora, sup cells, ice","Topic 27: food, labelling, regulations, additives, packaged"
438,75,0.3998888172995852,"Topic 438: subspecies, mitochondrial, genetic, weka, hawaiian","Topic 75: hunting, game, game hunting, game animals, hunting licence"
520,97,0.3124717048895099,"Topic 520: poaching, ranger, patrols, illegal, rhinoceros","Topic 97: small, enterprises, fund, small medium, medium enterprises"
194,37,0.4187196035056433,"Topic 194: salamander, genetic, connectivity, gene flow, landscape","Topic 37: heritage, aboriginal, cultural, cultural heritage, islander"
355,28,0.4821013177796857,"Topic 355: smw, whitefly, week, borer, pests","Topic 28: chemicals, dangerous, substances, dangerous goods, chemical"
356,95,0.4440527980879972,"Topic 356: sentinel, optical, classification, landsat, images","Topic 95: health, care, ncds, strategic, health care"
556,27,0.6145722785657781,"Topic 556: nps, nanoparticles, oxide nanoparticles, cuo nps, cuo","Topic 27: food, labelling, regulations, additives, packaged"
590,47,0.6939922544187204,"Topic 590: scent marks, scent, marks, chemical signals, chemical","Topic 47: varieties, directive, seed, vegetable, plant"
504,28,0.3344417930425974,"Topic 504: protist, protists, myxomycetes, 18s, sequences","Topic 28: chemicals, dangerous, substances, dangerous goods, chemical"
613,73,0.43534951801158855,"Topic 613: mining, restoration, msrs, site restoration, relinquishment","Topic 73: model, animals, animal, entry union, consignments"
323,28,0.4346920960313686,"Topic 323: la, que, en, los, las","Topic 28: chemicals, dangerous, substances, dangerous goods, chemical"
494,5,0.6516498614048104,"Topic 494: foraminifera, foraminiferal, planktonic foraminifera, planktonic, benthic foraminifera","Topic 5: waste, waste management, recycling, hazardous, disposal"
104,27,0.46441498729758324,"Topic 104: camera, duiker, mammal, chimpanzee, park","Topic 27: food, labelling, regulations, additives, packaged"
