Research_Topic_Num,Aligned_Policy_Topic_Num,Similarity_Score,Research_Topic_Label,Aligned_Policy_Topic_Label
640,97,0.31604616047839623,"Topic 640: macrosystems, macrosystems biology, csis, holarchic, scales","Topic 97: small, enterprises, fund, small medium, medium enterprises"
178,27,0.45773466978210425,"Topic 178: arthropod, arthropods, arthropod communities, roofs, arthropod diversity","Topic 27: food, labelling, regulations, additives, packaged"
222,5,0.48551791624284907,"Topic 222: sponge, sponges, sponge species, hma, bacterial","Topic 5: waste, waste management, recycling, hazardous, disposal"
146,82,0.31273908532988615,"Topic 146: recycling, scrap, waste, material, eol","Topic 82: variety, plant, varieties, breeder, breeders"
524,97,0.3675458321521408,"Topic 524: afm, gy, jats bold, bold, atomic force","Topic 97: small, enterprises, fund, small medium, medium enterprises"
617,5,0.5196291761596549,"Topic 617: asr, geladas, mud, mud substrate, females","Topic 5: waste, waste management, recycling, hazardous, disposal"
265,89,0.3742823343558575,"Topic 265: mammals, small mammals, mammal, small mammal, small","Topic 89: information, access information, access, disclosure, right access"
557,97,0.48541396880841553,"Topic 557: goby, round, round goby, gobies, smallmouth bass","Topic 97: small, enterprises, fund, small medium, medium enterprises"
271,28,0.650450697587564,"Topic 271: genome, mb, chromosome, n50, assembled","Topic 28: chemicals, dangerous, substances, dangerous goods, chemical"
223,66,0.18279130480358824,"Topic 223: green, urban, green spaces, spaces, ces","Topic 66: veterinary, veterinarian, veterinary services, veterinarians, registration"
645,28,0.4642354717390227,"Topic 645: cerrado, seed, cerrado jats, seedlings, italic cerrado","Topic 28: chemicals, dangerous, substances, dangerous goods, chemical"
339,44,0.35458883112716677,"Topic 339: alpine, warming, meadow, plateau, alpine meadow","Topic 44: virginia, chapter code, code virginia, commonwealth, chapter"
628,37,0.616513145995546,"Topic 628: mosquitofish, captive propagation, mosquitofish jats, guppy, igp","Topic 37: heritage, aboriginal, cultural, cultural heritage, islander"
465,97,0.4797084095265977,"Topic 465: phytoplankton, phytoplankton community, phytoplankton biomass, hico, diel","Topic 97: small, enterprises, fund, small medium, medium enterprises"
525,27,0.299243398459622,"Topic 525: soil, restoration, soil indicators, indicators, alh","Topic 27: food, labelling, regulations, additives, packaged"
662,27,0.37742978679093253,,"Topic 27: food, labelling, regulations, additives, packaged"
661,5,0.5327709765461222,,"Topic 5: waste, waste management, recycling, hazardous, disposal"
305,66,0.7129054853330397,"Topic 305: bird, sec jats, jats sec, sec, birds","Topic 66: veterinary, veterinarian, veterinary services, veterinarians, registration"
538,37,0.4575106110354992,"Topic 538: bacterial, artificial fishery, intestines, bacterial microbiota, bacterial communities","Topic 37: heritage, aboriginal, cultural, cultural heritage, islander"
487,36,0.39285929022147054,"Topic 487: inbreeding, inbreeding depression, depression, lt span, fitness","Topic 36: birds, migratory, wild birds, wild, duck"
622,27,0.37728832196406076,"Topic 622: amazonian, ade, amazonian tree, amazon, subregions","Topic 27: food, labelling, regulations, additives, packaged"
491,27,0.5525667526350164,"Topic 491: panda, giant, pandas, giant pandas, giant panda","Topic 27: food, labelling, regulations, additives, packaged"
344,7,0.33901514051449294,"Topic 344: crickets, males, male, cricket, females","Topic 7: nutrition, agriculture, food, sector, food security"
365,8,0.42874539796462774,"Topic 365: mastitis, cows, milk, udder, milking","Topic 8: land, registration, property, act, court"
555,97,0.4323967081551289,"Topic 555: 100g, leafy, lecithin, leafy vegetables, oil","Topic 97: small, enterprises, fund, small medium, medium enterprises"
552,28,0.40313841008353773,"Topic 552: hook, hooking, hooked, hooks, deep hooking","Topic 28: chemicals, dangerous, substances, dangerous goods, chemical"
582,5,0.41809586784708647,"Topic 582: rodent, rodent community, desert, blackbrush, rodent disturbance","Topic 5: waste, waste management, recycling, hazardous, disposal"
446,28,0.3708704672286801,"Topic 446: cavities, cavity, nest boxes, boxes, nest","Topic 28: chemicals, dangerous, substances, dangerous goods, chemical"
581,97,0.5173442511282477,"Topic 581: agave, aurea jats, aurea, italic aurea, cnm","Topic 97: small, enterprises, fund, small medium, medium enterprises"
506,97,0.5071839955617645,"Topic 506: rock, grouting, rock mass, pile, deformation","Topic 97: small, enterprises, fund, small medium, medium enterprises"
536,75,0.4998985965326097,"Topic 536: sludge, sewage sludge, sewage, bi, wastewater","Topic 75: hunting, game, game hunting, game animals, hunting licence"
629,59,0.6330150963443333,"Topic 629: dna jats, case dna, dna, case rna, rna jats","Topic 59: cooperative, cooperatives, operatives, societies, members"
654,5,0.5345934691684103,,"Topic 5: waste, waste management, recycling, hazardous, disposal"
377,34,0.45337703389465783,"Topic 377: lichen, lichens, lichen species, lichen communities, town","Topic 34: agricultural, farmers, purpose act, rural, contribute"
425,37,0.5107629172169103,"Topic 425: waste, pyrolysis, combustion, solid, msw","Topic 37: heritage, aboriginal, cultural, cultural heritage, islander"
540,5,0.45866079708285806,"Topic 540: ants, leafcutter, ant, fungus, clade fungi","Topic 5: waste, waste management, recycling, hazardous, disposal"
462,44,0.4053891340951441,"Topic 462: genetic, urban, gene flow, landscape, connectivity","Topic 44: virginia, chapter code, code virginia, commonwealth, chapter"
351,0,0.5266667033488152,"Topic 351: paradoxus jats, paradoxus, cerevisiae, yeast, cerevisiae jats","Topic 0: water, water resources, supply, water supply, resources"
488,6,0.3895503770541902,"Topic 488: allelopathy, allelopathic, germination, allelochemicals, extracts","Topic 6: plant, quarantine, plants, pests, phytosanitary"
317,5,0.4769594542020999,"Topic 317: carotenoid, pheomelanin, plumage, coloration, feathers","Topic 5: waste, waste management, recycling, hazardous, disposal"
601,59,0.4976254337784447,"Topic 601: em gt, lt em, em, lt, gt","Topic 59: cooperative, cooperatives, operatives, societies, members"
386,5,0.45841118899106853,"Topic 386: barcoding, barcode, barcodes, dna, bins","Topic 5: waste, waste management, recycling, hazardous, disposal"
419,28,0.5447042371389735,"Topic 419: coral, corals, reef, doc, fec13780","Topic 28: chemicals, dangerous, substances, dangerous goods, chemical"
490,97,0.4757413832931584,"Topic 490: matk, barcode, barcodes, rbcl, dna barcode","Topic 97: small, enterprises, fund, small medium, medium enterprises"
656,97,0.5966686230687752,,"Topic 97: small, enterprises, fund, small medium, medium enterprises"
310,27,0.4716715820052209,"Topic 310: heat, evaporative, birds, thermoregulatory, temperatures","Topic 27: food, labelling, regulations, additives, packaged"
477,97,0.3274997691903103,"Topic 477: mistletoe, mistletoes, host, hosts, parasitized","Topic 97: small, enterprises, fund, small medium, medium enterprises"
483,78,0.6029642175271948,"Topic 483: compounds, methylisoxazol, reaction, chromen, nmr","Topic 78: investment, investors, investments, economic, investor"
393,27,0.3266542643481969,"Topic 393: oil, crude oil, crude, hydrocarbon, hydrocarbons","Topic 27: food, labelling, regulations, additives, packaged"
240,122,0.5808053218775864,"Topic 240: nutritional, food, protein, bears, intake","Topic 122: minnesota, public waters, chapter minnesota, minnesota statutes, drainage"
282,44,0.4845090269085486,"Topic 282: britain, british isles, isles, biological flora, habitat communities","Topic 44: virginia, chapter code, code virginia, commonwealth, chapter"
453,97,0.4334752517935456,"Topic 453: wing, butterflies, colour, alba females, colour pattern","Topic 97: small, enterprises, fund, small medium, medium enterprises"
394,5,0.589510904838208,"Topic 394: ducks, wetland, waterbird, wetlands, duck","Topic 5: waste, waste management, recycling, hazardous, disposal"
531,10,0.40172504042177604,"Topic 531: seal, seals, ringed, saimaa, ringed seal","Topic 10: food, food safety, safety, food authority, standards"
426,92,0.19915850664802276,"Topic 426: idps, ukraine, territorial communities, territorial, agrarian potential","Topic 92: europe, social, crisis, cohesion, recovery"
580,5,0.5039313893048735,"Topic 580: ash, eab, planipennis jats, planipennis, eab jats","Topic 5: waste, waste management, recycling, hazardous, disposal"
296,27,0.36476168357085187,"Topic 296: resilience, restoration, trait, ecological resilience, trait based","Topic 27: food, labelling, regulations, additives, packaged"
273,27,0.5720163376289453,"Topic 273: waste, waste management, solid waste, msw, solid","Topic 27: food, labelling, regulations, additives, packaged"
166,77,0.33474735589896937,"Topic 166: spiders, spider, prey, web, predators","Topic 77: land, crown, lands, fence, crown lands"
636,82,0.29711690090892723,"Topic 636: sagebrush, bunchgrasses, native bunchgrasses, tridentata jats, tridentata","Topic 82: variety, plant, varieties, breeder, breeders"
354,27,0.36975392098652643,"Topic 354: noise, noise pollution, noise level, pollution, db","Topic 27: food, labelling, regulations, additives, packaged"
347,6,0.4017552450413636,"Topic 347: corporate, firms, disclosure, companies, esg","Topic 6: plant, quarantine, plants, pests, phytosanitary"
486,5,0.45058124479446676,"Topic 486: deep sea, tubeworms, regab, piscesae, piscesae jats","Topic 5: waste, waste management, recycling, hazardous, disposal"
638,94,0.3084107366766064,"Topic 638: melanogaster, melanogaster jats, simulans jats, simulans, italic melanogaster","Topic 94: carolina, south carolina, south, carolina code, code laws"
57,34,0.5873180514161402,"Topic 57: parasite, host, parasites, disease, transmission","Topic 34: agricultural, farmers, purpose act, rural, contribute"
634,28,0.45177625909136887,"Topic 634: vibrio, cholerae, cholerae jats, sp, vibrio sp","Topic 28: chemicals, dangerous, substances, dangerous goods, chemical"
471,37,0.46143855625133123,"Topic 471: jats amp, amp nbsp, nbsp, nbsp jats, amp","Topic 37: heritage, aboriginal, cultural, cultural heritage, islander"
331,73,0.6415821265127368,"Topic 331: paper published, published accessed, jats amendment, amendment paper, accessed","Topic 73: model, animals, animal, entry union, consignments"
547,28,0.5600335081029986,"Topic 547: carbon emissions, carbon, carbon neutrality, neutrality, carbon neutral","Topic 28: chemicals, dangerous, substances, dangerous goods, chemical"
549,76,0.603516642151587,"Topic 549: hypervolume, hypervolumes, niche, kde, italic dimensional","Topic 76: dakota, south dakota, district, south, chief engineer"
635,28,0.3794562776054585,"Topic 635: waste, plastic, recycling, packaging, pet","Topic 28: chemicals, dangerous, substances, dangerous goods, chemical"
651,97,0.3459389993611633,,"Topic 97: small, enterprises, fund, small medium, medium enterprises"
476,34,0.42213672207533964,"Topic 476: conspecific, cndd, density dependence, seedling, dependence","Topic 34: agricultural, farmers, purpose act, rural, contribute"
398,27,0.5178571664906102,"Topic 398: fedotova, dagestan, gall midges, gall, midges","Topic 27: food, labelling, regulations, additives, packaged"
285,31,0.496523028550786,"Topic 285: parasite, parasites, fish, parasite abundance, host","Topic 31: port, ports, maritime, navigation, vessels"
550,22,0.6715725791961299,"Topic 550: allochrony, winter populations, summer population, cactorum, allochronic","Topic 22: plastic, packaging, single use, use plastic, bags"
614,97,0.45705371892173186,"Topic 614: radiation, adaptive radiation, radiations, adaptive, diversification","Topic 97: small, enterprises, fund, small medium, medium enterprises"
450,27,0.44680450764612867,"Topic 450: professional, medical, students, educational, training","Topic 27: food, labelling, regulations, additives, packaged"
251,97,0.4611240569502807,"Topic 251: landscape, aesthetic, green, landscape ecology, urban","Topic 97: small, enterprises, fund, small medium, medium enterprises"
457,7,0.3468554522125898,"Topic 457: science, citizen, public, conservation, citizen science","Topic 7: nutrition, agriculture, food, sector, food security"
367,77,0.35638949475170784,"Topic 367: medicinal, javan deer, mushrooms, javan, plants","Topic 77: land, crown, lands, fence, crown lands"
587,97,0.46452510067774233,"Topic 587: seal, seals, harbour, harbour seals, harbor","Topic 97: small, enterprises, fund, small medium, medium enterprises"
368,97,0.4042723098800817,"Topic 368: girls, boys, schoolchildren, children, school children","Topic 97: small, enterprises, fund, small medium, medium enterprises"
275,89,0.17886061644908197,"Topic 275: vibration, vibration disease, jats bold, bold, vd","Topic 89: information, access information, access, disclosure, right access"
307,5,0.3933006834465691,"Topic 307: refugia, glacial, lgm, alps, nunatak","Topic 5: waste, waste management, recycling, hazardous, disposal"
469,28,0.4457919716168135,"Topic 469: urban, urban biodiversity, luxury effect, biodiversity, luxury","Topic 28: chemicals, dangerous, substances, dangerous goods, chemical"
609,97,0.2394393176943554,"Topic 609: jec13107, jec13107 math, biocrust, biocrusts, graphic","Topic 97: small, enterprises, fund, small medium, medium enterprises"
288,27,0.5876513434673747,"Topic 288: coordination, coordinated development, coordinated, coupling coordination, development","Topic 27: food, labelling, regulations, additives, packaged"
514,44,0.49116304215401807,"Topic 514: forest restoration, restoration, timber, forest, atlantic forest","Topic 44: virginia, chapter code, code virginia, commonwealth, chapter"
443,27,0.5392804509349581,"Topic 443: warming, soil respiration, soil, respiration, mbc","Topic 27: food, labelling, regulations, additives, packaged"
168,40,0.3616243518189671,"Topic 168: wetlands, wetland, jats roman, roman, slr","Topic 40: principal act, section, principal, regarding, words"
474,97,0.40531046140203636,"Topic 474: sulfate, bacteria, sulfate reducing, desulfuromonas, so42","Topic 97: small, enterprises, fund, small medium, medium enterprises"
382,46,0.561185305988599,"Topic 382: otolith, otoliths, sr, whitefish, sup sr","Topic 46: california, pest, agricultural code, california food, food agricultural"
543,44,0.4716040087747642,"Topic 543: xlink, 1002 ece3, org, ece3, 10 1002","Topic 44: virginia, chapter code, code virginia, commonwealth, chapter"
404,75,0.4537772734824704,"Topic 404: polyploid, ploidy, polyploids, jats sc, sc","Topic 75: hunting, game, game hunting, game animals, hunting licence"
455,59,0.688716950363768,"Topic 455: dune, dunes, sand, coastal, surrogate wrack","Topic 59: cooperative, cooperatives, operatives, societies, members"
37,12,0.6396677317734716,"Topic 37: dung, beetle, beetles, dung beetle, dung beetles","Topic 12: covid 19, covid, 19, movement, essential"
606,97,0.4117878655705825,"Topic 606: replication, pseudoreplication, replicability, study replication, replication studies","Topic 97: small, enterprises, fund, small medium, medium enterprises"
511,7,0.45144303684135323,"Topic 511: pests, pest, native, invasive, non native","Topic 7: nutrition, agriculture, food, sector, food security"
576,64,0.37330255668578954,"Topic 576: mete, entropy, theory, antientropy, entropy theory","Topic 64: petroleum, gas, midstream, petroleum industry, petroleum products"
548,28,0.4638581898009151,"Topic 548: dispatchers, professional, jats bold, bold, sensory loads","Topic 28: chemicals, dangerous, substances, dangerous goods, chemical"
528,28,0.39022851427444993,"Topic 528: lichen, photobionts, photobiont, mycobiont, lichens","Topic 28: chemicals, dangerous, substances, dangerous goods, chemical"
607,97,0.5033851733636119,"Topic 607: fishing, catch, angler, stocking, angling","Topic 97: small, enterprises, fund, small medium, medium enterprises"
246,89,0.32844806497187723,"Topic 246: reviewers, author, peer review, journals, editors","Topic 89: information, access information, access, disclosure, right access"
493,82,0.3356736688502864,"Topic 493: hybrid, introgression, balsamifera jats, balsamifera, trichocarpa jats","Topic 82: variety, plant, varieties, breeder, breeders"
333,5,0.5464947322836566,"Topic 333: earthworms, earthworm, soil, earthworm species, invasive earthworms","Topic 5: waste, waste management, recycling, hazardous, disposal"
401,6,0.434808999981826,"Topic 401: oil palm, palm, oil, replanting, palm plantations","Topic 6: plant, quarantine, plants, pests, phytosanitary"
546,97,0.420472978776225,"Topic 546: subsidy, subsidies, nsp, food quality, consumer","Topic 97: small, enterprises, fund, small medium, medium enterprises"
545,97,0.48907484838792226,"Topic 545: regeneration, natural regeneration, seedling, restoration, seedlings","Topic 97: small, enterprises, fund, small medium, medium enterprises"
439,27,0.3239274260619223,"Topic 439: stata, biomedical, stata software, software, biomedical research","Topic 27: food, labelling, regulations, additives, packaged"
508,5,0.42287483121568176,"Topic 508: mfa, uncertainty, material flow, analysis mfa, material","Topic 5: waste, waste management, recycling, hazardous, disposal"
482,28,0.45657332103368564,"Topic 482: larval, connectivity, larvae, larval dispersal, cockle","Topic 28: chemicals, dangerous, substances, dangerous goods, chemical"
570,97,0.4479518307304664,"Topic 570: trait, trait values, detection filtering, rtry, trait environment","Topic 97: small, enterprises, fund, small medium, medium enterprises"
297,89,0.3420565851113678,"Topic 297: eeg, brain, p300, adolescents, theta","Topic 89: information, access information, access, disclosure, right access"
653,59,0.3315371925401876,,"Topic 59: cooperative, cooperatives, operatives, societies, members"
605,44,0.33344404216081075,"Topic 605: amber, mid cretaceous, cretaceous, fossil, extant","Topic 44: virginia, chapter code, code virginia, commonwealth, chapter"
593,59,0.43634362967940404,"Topic 593: soaring, crossing, winds, wind, flight","Topic 59: cooperative, cooperatives, operatives, societies, members"
578,7,0.314088549716912,"Topic 578: thaliana jats, thaliana, genetic, phenotypic, italic arabidopsis","Topic 7: nutrition, agriculture, food, sector, food security"
206,27,0.4307716823004499,"Topic 206: wns, white nose, bats, nose syndrome, nose","Topic 27: food, labelling, regulations, additives, packaged"
637,27,0.37732043020578365,"Topic 637: hinterland, megafan, hinterland forest, canopy height, forest","Topic 27: food, labelling, regulations, additives, packaged"
599,19,0.5133008778414694,"Topic 599: winter minimum, runoff, minimum, basin, sevan","Topic 19: maine, hampshire, new hampshire, statutes, revised statutes"
451,62,0.3503005323646933,"Topic 451: risk, risk effects, prey, predation risk, iiv","Topic 62: antimicrobial, resistance, amr, antimicrobial resistance, antibiotic"
660,27,0.31003017054808785,,"Topic 27: food, labelling, regulations, additives, packaged"
459,15,0.433942699381915,"Topic 459: manufacturing, energy consumption, printing, additive manufacturing, 3d printing","Topic 15: eu, union, regulation, fishing, union waters"
639,93,0.6876942517263223,"Topic 639: mouse, bank vole, wood mouse, pygmy wood, vole","Topic 93: virginia, fund, provides rules, chapter, services virginia"
458,27,0.4046684489798895,"Topic 458: water, gasoline, toxicity, wastewater, pesticides","Topic 27: food, labelling, regulations, additives, packaged"
568,27,0.4218801594808813,"Topic 568: bird, elevational, richness, birds, elevational range","Topic 27: food, labelling, regulations, additives, packaged"
277,5,0.47071241744760345,"Topic 277: cadmium, lead, mg kg, feed, rats","Topic 5: waste, waste management, recycling, hazardous, disposal"
447,62,0.640108286186623,"Topic 447: radar, radars, wsr, wsr jats, case wsr","Topic 62: antimicrobial, resistance, amr, antimicrobial resistance, antibiotic"
630,21,0.3574979240390604,"Topic 630: iam jats, case iam, iam, biodiversity, ar","Topic 21: washington, rcw, code washington, washington rcw, chapter revised"
495,116,0.5063667244434782,"Topic 495: microclimate, microclimates, myclim, myclim jats, jats sc","Topic 116: modifying, national parks, regulations, modifying related, related export"
337,6,0.7689366756254679,"Topic 337: forecasting, forecasts, models, forecast, ecological","Topic 6: plant, quarantine, plants, pests, phytosanitary"
644,77,0.37254623099707274,"Topic 644: riparian, riparian vegetation, gw, riparian guilds, gw discharge","Topic 77: land, crown, lands, fence, crown lands"
411,24,0.6150346969098813,"Topic 411: frost, phenological, chilling, budburst, phenology","Topic 24: species, endangered, endangered species, cites, fauna flora"
595,122,0.5819862049903367,"Topic 595: fluoxetine, twospot, livebearers, fin, predator","Topic 122: minnesota, public waters, chapter minnesota, minnesota statutes, drainage"
615,27,0.5027051634520063,"Topic 615: floodplain, wetland, buekii jats, buekii, flooding","Topic 27: food, labelling, regulations, additives, packaged"
350,37,0.486255757451613,"Topic 350: wolf, wolves, red wolf, coyotes, dogs","Topic 37: heritage, aboriginal, cultural, cultural heritage, islander"
326,27,0.6888373350254207,"Topic 326: sw, variable, model, regression, linear","Topic 27: food, labelling, regulations, additives, packaged"
564,27,0.30221059953418117,"Topic 564: elephants, musth, tusk, age, asian elephants","Topic 27: food, labelling, regulations, additives, packaged"
114,62,0.572144873702477,"Topic 114: range, niche, sec jats, jats sec, sec","Topic 62: antimicrobial, resistance, amr, antimicrobial resistance, antibiotic"
299,40,0.28456733956188585,"Topic 299: photocatalytic, dye, uv, oxidation, phenol","Topic 40: principal act, section, principal, regarding, words"
130,20,0.3774834966035984,"Topic 130: males, females, dominance, female, male","Topic 20: climate, climate change, change, greenhouse, emissions"
626,15,0.23187809438217605,"Topic 626: catalysts, catalytic, gasolines, reforming, catalyst","Topic 15: eu, union, regulation, fishing, union waters"
127,74,0.43171685540715654,"Topic 127: flowering, phenological, phenology, flowering phenology, warming","Topic 74: indiana, code concerns, indiana code, water, code"
575,46,0.42679483823134645,"Topic 575: case jats, case cpue, cpue jats, jats styled, styled content","Topic 46: california, pest, agricultural code, california food, food agricultural"
561,0,0.5029134592779843,"Topic 561: genome, assembly, genome assembly, chip, hihi","Topic 0: water, water resources, supply, water supply, resources"
229,34,0.6292091999750067,"Topic 229: wild meat, trade, meat, wildlife, pet","Topic 34: agricultural, farmers, purpose act, rural, contribute"
498,111,0.17631696716348494,"Topic 498: sika, deer, sika deer, red deer, arvalis","Topic 111: water, california, water code, water quality, regional board"
373,1,0.44798093148751306,"Topic 373: seed dispersal, frugivore, seed, frugivores, networks","Topic 1: agricultural, export, marketing, products, meat"
414,8,0.595583962378227,"Topic 414: batteries, battery, lithium, recycling, libs","Topic 8: land, registration, property, act, court"
592,15,0.26727312785124546,"Topic 592: venom, toxin, venoms, pmg, proteins","Topic 15: eu, union, regulation, fishing, union waters"
417,8,0.2856948622851073,"Topic 417: retention, deadwood, forests, unmanaged, forest","Topic 8: land, registration, property, act, court"
485,66,0.08387004416589147,"Topic 485: pigs, wild boar, boar, feral, wild","Topic 66: veterinary, veterinarian, veterinary services, veterinarians, registration"
154,66,0.3007846952548269,"Topic 154: sec jats, jats sec, sec, phylogenetic, angiosperm","Topic 66: veterinary, veterinarian, veterinary services, veterinarians, registration"
378,77,0.5256512261640253,"Topic 378: host, speciation, hawthorn, italic rhagoletis, rhagoletis","Topic 77: land, crown, lands, fence, crown lands"
431,6,0.49814285356227733,"Topic 431: worker, workers, queen, queens, eusocial","Topic 6: plant, quarantine, plants, pests, phytosanitary"
202,5,0.6757664602638173,"Topic 202: skull, cranial, triassic, amniote, palaeolagus","Topic 5: waste, waste management, recycling, hazardous, disposal"
472,12,0.5980889647431631,"Topic 472: metacommunity, metacommunities, dispersal, metacommunity theory, coexistence","Topic 12: covid 19, covid, 19, movement, essential"
309,77,0.40360420076477804,"Topic 309: metals, heavy, heavy metals, cd, pb","Topic 77: land, crown, lands, fence, crown lands"
619,97,0.4296043962636394,"Topic 619: applied nucleation, nucleation, restoration, fertilization ph, ph correction","Topic 97: small, enterprises, fund, small medium, medium enterprises"
48,66,0.3004095060313657,"Topic 48: seagrass, eelgrass, meadows, seagrasses, marina jats","Topic 66: veterinary, veterinarian, veterinary services, veterinarians, registration"
234,42,0.37501260376375145,"Topic 234: dna, museum, specimens, endogenous, samples","Topic 42: measure, ccamlr, conservation, conservation measure, krill"
410,59,0.640560911514138,"Topic 410: genome, tetraploid, diploid, polyploidization, polyploidy","Topic 59: cooperative, cooperatives, operatives, societies, members"
623,34,0.454886495157158,"Topic 623: oxidative, stopover, pufas, fat, birds","Topic 34: agricultural, farmers, purpose act, rural, contribute"
650,23,0.19476510198700356,,"Topic 23: radiation, nuclear, radioactive, radioactive waste, ionising radiation"
461,20,0.31858600565723777,"Topic 461: diversification, speciation extinction, fossil, extinction, phylogenetic","Topic 20: climate, climate change, change, greenhouse, emissions"
