Research_Topic_Num,Aligned_Policy_Topic_Num,Similarity_Score,Research_Topic_Label,Aligned_Policy_Topic_Label
182,97,0.48344250219986085,"Topic 182: orchid, orchids, orchid species, orchidaceae, pope12098","Topic 97: small, enterprises, fund, small medium, medium enterprises"
47,37,0.4003446713600173,"Topic 47: seed, seeds, seed dispersal, dispersal, dispersed","Topic 37: heritage, aboriginal, cultural, cultural heritage, islander"
415,28,0.4487839345877201,"Topic 415: career, graduate, mentorship, inclusive, students","Topic 28: chemicals, dangerous, substances, dangerous goods, chemical"
440,62,0.5360536416541869,"Topic 440: patients, jats bold, bold, anesthesia, carotid","Topic 62: antimicrobial, resistance, amr, antimicrobial resistance, antibiotic"
330,10,0.38759584948410014,"Topic 330: vitamin, obesity, glucose, women, bmi","Topic 10: food, food safety, safety, food authority, standards"
429,27,0.29732104622287225,"Topic 429: morphs, charr, arctic charr, morph, italic salvelinus","Topic 27: food, labelling, regulations, additives, packaged"
261,44,0.44119150787333006,"Topic 261: extinction, speciation, diversification, fossil, macroevolutionary","Topic 44: virginia, chapter code, code virginia, commonwealth, chapter"
325,59,0.5268834569506098,"Topic 325: bamboo, bamboos, moso, bamboo species, moso bamboo","Topic 59: cooperative, cooperatives, operatives, societies, members"
219,97,0.41720163852114606,"Topic 219: eco evolutionary, eco, evolutionary, evolutionary dynamics, evolution","Topic 97: small, enterprises, fund, small medium, medium enterprises"
413,6,0.7208826396594028,"Topic 413: nanoparticles, zno, nps, zno nps, synthesized","Topic 6: plant, quarantine, plants, pests, phytosanitary"
134,27,0.4890012552752905,"Topic 134: chloroplast, plastomes, plastome, chloroplast genomes, genomes","Topic 27: food, labelling, regulations, additives, packaged"
42,97,0.3999060884698728,"Topic 42: scr, recapture, capture recapture, capture, estimates","Topic 97: small, enterprises, fund, small medium, medium enterprises"
10,59,0.38379025740296047,"Topic 10: butterfly, butterflies, diapause, butterfly species, temperature","Topic 59: cooperative, cooperatives, operatives, societies, members"
364,1,0.5818448471559737,"Topic 364: sex, chromosome, sex determination, sex determining, determination","Topic 1: agricultural, export, marketing, products, meat"
258,97,0.4265639632691518,"Topic 258: phytoplankton, algae, chlorophyceae, algal, cyanophyceae","Topic 97: small, enterprises, fund, small medium, medium enterprises"
664,34,0.45383325407159825,,"Topic 34: agricultural, farmers, purpose act, rural, contribute"
600,37,0.3381780663431309,"Topic 600: compost, manure, dead birds, birds litter, litter manure","Topic 37: heritage, aboriginal, cultural, cultural heritage, islander"
262,28,0.44638797655109375,"Topic 262: spiders, spider, orb, glue, silk","Topic 28: chemicals, dangerous, substances, dangerous goods, chemical"
502,23,0.5786155102799925,"Topic 502: digital, carbon emission, digital economy, emission, carbon","Topic 23: radiation, nuclear, radioactive, radioactive waste, ionising radiation"
228,27,0.35693295975241796,"Topic 228: china, genetic, italic, jats italic, qtp","Topic 27: food, labelling, regulations, additives, packaged"
65,7,0.4974417253145978,"Topic 65: political, political ecology, indigenous, article, extractivism","Topic 7: nutrition, agriculture, food, sector, food security"
409,97,0.4503398385063995,"Topic 409: epp, extra, pair, extra pair, mating","Topic 97: small, enterprises, fund, small medium, medium enterprises"
41,27,0.40103502687327186,"Topic 41: camera, camera trap, camera traps, trap, traps","Topic 27: food, labelling, regulations, additives, packaged"
270,68,0.40905357553416827,"Topic 270: plasticity, phenotypic plasticity, traits, climate, phenotypic","Topic 68: fuels, biomass, biofuels, renewable, scheme"
293,97,0.39694780272116004,"Topic 293: cancer, cells, tumor, cancer cells, cell","Topic 97: small, enterprises, fund, small medium, medium enterprises"
294,27,0.5634255761748613,"Topic 294: fig, figs, wasps, wasp, italic ficus","Topic 27: food, labelling, regulations, additives, packaged"
553,5,0.4603208477816339,"Topic 553: nest, nest defense, nests, defense, ifb","Topic 5: waste, waste management, recycling, hazardous, disposal"
534,44,0.3297151398642865,"Topic 534: drilling, waste, drilling waste, mining, tailings","Topic 44: virginia, chapter code, code virginia, commonwealth, chapter"
141,59,0.4893105213554428,"Topic 141: fish, liver, carp, gills, protein","Topic 59: cooperative, cooperatives, operatives, societies, members"
213,97,0.4027652700893263,"Topic 213: tourism, tourist, tourists, ecotourism, masbate","Topic 97: small, enterprises, fund, small medium, medium enterprises"
348,97,0.448754385621774,"Topic 348: biofilm, biofilms, biofilm formation, microorganisms, formation","Topic 97: small, enterprises, fund, small medium, medium enterprises"
88,28,0.40962081424298724,"Topic 88: river, dam, flow, stream, dam removal","Topic 28: chemicals, dangerous, substances, dangerous goods, chemical"
27,37,0.3977161319574112,"Topic 27: coral, corals, bleaching, symbiodiniaceae, symbiodinium","Topic 37: heritage, aboriginal, cultural, cultural heritage, islander"
195,37,0.3526705209060995,"Topic 195: island, islands, genetic, annua jats, annua","Topic 37: heritage, aboriginal, cultural, cultural heritage, islander"
454,82,0.30036605489950546,"Topic 454: tuberculosis, tb, eptb, patients, hiv","Topic 82: variety, plant, varieties, breeder, breeders"
221,28,0.27292345754620684,"Topic 221: si, silicon, herbivore, si accumulation, defences","Topic 28: chemicals, dangerous, substances, dangerous goods, chemical"
191,37,0.5718895585498086,"Topic 191: prey, functional response, functional responses, predator, feeding rates","Topic 37: heritage, aboriginal, cultural, cultural heritage, islander"
291,27,0.44866017520108487,"Topic 291: locomotor, locomotion, body, body size, extinct","Topic 27: food, labelling, regulations, additives, packaged"
51,27,0.42897889208083234,"Topic 51: trout, fish, river, stream, brook trout","Topic 27: food, labelling, regulations, additives, packaged"
342,59,0.5169494225263053,"Topic 342: masting, mast, synchrony, seed, production","Topic 59: cooperative, cooperatives, operatives, societies, members"
430,27,0.536878676851051,"Topic 430: editors note, earth hydrosphere, guest editors, hydrosphere 96, jats guest","Topic 27: food, labelling, regulations, additives, packaged"
171,10,0.3871463680840565,"Topic 171: food web, web, food, webs, food webs","Topic 10: food, food safety, safety, food authority, standards"
77,97,0.418459409358566,"Topic 77: cats, cat, feral, dingoes, feral cats","Topic 97: small, enterprises, fund, small medium, medium enterprises"
159,27,0.47716759659843666,"Topic 159: medical, health, care, medical care, 95 ci","Topic 27: food, labelling, regulations, additives, packaged"
53,73,0.62735616082477,"Topic 53: demographic, population, vital rates, population growth, matrix","Topic 73: model, animals, animal, entry union, consignments"
445,59,0.6850176575829381,"Topic 445: services, forest, ecosystem services, nnt, multifunctionality","Topic 59: cooperative, cooperatives, operatives, societies, members"
138,27,0.5426350664381099,"Topic 138: parasitoid, parasitoids, host, aphid, egg","Topic 27: food, labelling, regulations, additives, packaged"
428,66,0.20144477332953403,"Topic 428: stressors, stressor, multiple stressors, stressor effects, multiple","Topic 66: veterinary, veterinarian, veterinary services, veterinarians, registration"
384,97,0.4322547261463458,"Topic 384: colour, color, visual, colour patterns, colour pattern","Topic 97: small, enterprises, fund, small medium, medium enterprises"
76,77,0.5511471098537168,"Topic 76: mosquito, aegypti, mosquitoes, aegypti jats, ae","Topic 77: land, crown, lands, fence, crown lands"
46,5,0.4717087785860168,"Topic 46: images, learning, deep learning, image, deep","Topic 5: waste, waste management, recycling, hazardous, disposal"
99,59,0.4884118568971071,"Topic 99: succession, assembly, diversity, grassland, grasslands","Topic 59: cooperative, cooperatives, operatives, societies, members"
115,82,0.4040320203675694,"Topic 115: input output, emissions, footprint, mrio, sectors","Topic 82: variety, plant, varieties, breeder, breeders"
591,34,0.46177399634509986,"Topic 591: trematode, snail, parasite, snail host, host","Topic 34: agricultural, farmers, purpose act, rural, contribute"
239,37,0.4748454223018962,"Topic 239: shell, snails, snail, ecotypes, snail jats","Topic 37: heritage, aboriginal, cultural, cultural heritage, islander"
254,27,0.43930187719690444,"Topic 254: bighorn, bighorn sheep, sheep, horn, females","Topic 27: food, labelling, regulations, additives, packaged"
521,82,0.38658981431925926,"Topic 521: jats sub, sub, co2, photosynthetic, max25 jats","Topic 82: variety, plant, varieties, breeder, breeders"
197,74,0.6708436782164097,"Topic 197: sequencing, microbial, rrna, 16s, sequence","Topic 74: indiana, code concerns, indiana code, water, code"
379,97,0.3010671703349703,"Topic 379: methylation, age, epigenetic, dna methylation, epigenetic clocks","Topic 97: small, enterprises, fund, small medium, medium enterprises"
500,59,0.5404803800261444,"Topic 500: stickleback, freshwater, uist, plate, threespine stickleback","Topic 59: cooperative, cooperatives, operatives, societies, members"
75,28,0.39674338174384755,"Topic 75: disease, trichoderma, fungicides, blight, fusarium","Topic 28: chemicals, dangerous, substances, dangerous goods, chemical"
274,10,0.4501301350844265,"Topic 274: plasticity, phenotypic, phenotypic plasticity, sensitive periods, plastic","Topic 10: food, food safety, safety, food authority, standards"
558,27,0.4223365695055882,"Topic 558: bufadienolide, tadpoles, bufadienolides, toad, toxin","Topic 27: food, labelling, regulations, additives, packaged"
407,97,0.4421328187328209,"Topic 407: abortions, 95 ci, ci, birth, 95","Topic 97: small, enterprises, fund, small medium, medium enterprises"
21,27,0.5445140585406675,"Topic 21: edna, metabarcoding, dna, environmental dna, edna metabarcoding","Topic 27: food, labelling, regulations, additives, packaged"
63,110,0.5107370599505356,"Topic 63: thermal, temperature, temperatures, ectotherms, body","Topic 110: emergency, coronavirus covid, novel coronavirus, novel, coronavirus"
12,97,0.5627544487862187,"Topic 12: rhizosphere, bacterial, rhizobia, bacteria, strains","Topic 97: small, enterprises, fund, small medium, medium enterprises"
602,37,0.5835156249990623,"Topic 602: ndvi, veq, vegetation, ndvi value, evi","Topic 37: heritage, aboriginal, cultural, cultural heritage, islander"
422,5,0.46045335242000457,"Topic 422: styled content, jats styled, styled, content, fixed case","Topic 5: waste, waste management, recycling, hazardous, disposal"
109,97,0.5017241168674007,"Topic 109: radiation, radon, bq, radioactive, radionuclides","Topic 97: small, enterprises, fund, small medium, medium enterprises"
39,34,0.49068437063767323,"Topic 39: migration, migratory, breeding, migrants, wintering","Topic 34: agricultural, farmers, purpose act, rural, contribute"
329,62,0.3700615850692807,"Topic 329: collision, wind, turbines, flight, wind turbines","Topic 62: antimicrobial, resistance, amr, antimicrobial resistance, antibiotic"
133,27,0.4985415912666669,"Topic 133: nest, nests, incubation, recesses, nesting","Topic 27: food, labelling, regulations, additives, packaged"
479,65,0.1620781011204846,"Topic 479: sacroiliac, ligaments, ligament, dorsal sacroiliac, long dorsal","Topic 65: payments, direct payments, rural development, eu, direct"
209,97,0.5100180678672845,"Topic 209: sheep, goat, breeds, goats, bighorn","Topic 97: small, enterprises, fund, small medium, medium enterprises"
35,97,0.35315107650775385,"Topic 35: jats bold, bold, new species, herbarium, genus","Topic 97: small, enterprises, fund, small medium, medium enterprises"
38,44,0.5758498203145915,"Topic 38: mangrove, mangroves, mangrove forests, carbon, coastal","Topic 44: virginia, chapter code, code virginia, commonwealth, chapter"
395,66,0.2373839674821994,"Topic 395: neural network, neural, forecasting, ann, forecast","Topic 66: veterinary, veterinarian, veterinary services, veterinarians, registration"
361,97,0.46467887311087214,"Topic 361: giraffe, giraffes, giraffa, camelopardalis, giraffa camelopardalis","Topic 97: small, enterprises, fund, small medium, medium enterprises"
470,5,0.5687361377576975,"Topic 470: dispersal, parentage, reef, larval dispersal, larval","Topic 5: waste, waste management, recycling, hazardous, disposal"
655,27,0.4652348033029722,,"Topic 27: food, labelling, regulations, additives, packaged"
32,59,0.44015938466257326,"Topic 32: salmon, atlantic salmon, chinook, salmon jats, chinook salmon","Topic 59: cooperative, cooperatives, operatives, societies, members"
238,30,0.25899169904247954,"Topic 238: industrial, industrial symbiosis, industrial ecology, business, symbiosis","Topic 30: catch, statistical, season, dissostichus, conservation measure"
544,28,0.37434781389467137,"Topic 544: turn taking, vocal, duetting, repertoires, singing","Topic 28: chemicals, dangerous, substances, dangerous goods, chemical"
52,97,0.44310298084467264,"Topic 52: ant, ants, ant species, efn, extrafloral","Topic 97: small, enterprises, fund, small medium, medium enterprises"
188,27,0.5946443290300498,"Topic 188: land, lulc, land cover, landsat, land use","Topic 27: food, labelling, regulations, additives, packaged"
74,97,0.3868835999179101,"Topic 74: land, land use, ecological, cultivated land, habitat quality","Topic 97: small, enterprises, fund, small medium, medium enterprises"
402,94,0.35953132530571397,"Topic 402: fence, fencing, fences, crossing, wildlife","Topic 94: carolina, south carolina, south, carolina code, code laws"
16,5,0.42257588695886944,"Topic 16: water, water quality, quality, drinking, groundwater","Topic 5: waste, waste management, recycling, hazardous, disposal"
153,27,0.5073670440566348,"Topic 153: pheromone, olfactory, chemosensory, sex pheromone, odorant","Topic 27: food, labelling, regulations, additives, packaged"
280,5,0.4448219777279495,"Topic 280: case edna, edna jats, edna, dna jats, case dna","Topic 5: waste, waste management, recycling, hazardous, disposal"
616,97,0.41122395057726613,"Topic 616: spawn, mushroom, vitamin d2, vitamin, pf","Topic 97: small, enterprises, fund, small medium, medium enterprises"
366,97,0.4146641781262353,"Topic 366: farmland, aes, farmland birds, farmsteads, bird","Topic 97: small, enterprises, fund, small medium, medium enterprises"
132,28,0.4930350923086371,"Topic 132: deposits, rocks, gas, tectonic, formation","Topic 28: chemicals, dangerous, substances, dangerous goods, chemical"
324,5,0.40666391716596617,"Topic 324: network, social, social network, permutations, animal social","Topic 5: waste, waste management, recycling, hazardous, disposal"
140,5,0.6255956323135426,"Topic 140: elephants, elephant, italic loxodonta, loxodonta, savannah","Topic 5: waste, waste management, recycling, hazardous, disposal"
25,5,0.5190803266570306,"Topic 25: restoration, ecological restoration, projects, restoration projects, ecological","Topic 5: waste, waste management, recycling, hazardous, disposal"
119,103,0.5276161686080524,"Topic 119: malaria, anopheles, italic anopheles, plasmodium, falciparum","Topic 103: residue, maximum residue, maximum, pesticide, annex"
179,92,0.27628774054951505,"Topic 179: nematode, soil, nematodes, soil nematode, nematode communities","Topic 92: europe, social, crisis, cohesion, recovery"
29,28,0.4157375397309477,"Topic 29: occupancy, detection, sampling, models, model","Topic 28: chemicals, dangerous, substances, dangerous goods, chemical"
449,34,0.6022955103916332,"Topic 449: flood, coping, flood coping, disaster, coping mechanism","Topic 34: agricultural, farmers, purpose act, rural, contribute"
392,44,0.4156697011840466,"Topic 392: elegans jats, elegans, italic elegans, dauer, italic caenorhabditis","Topic 44: virginia, chapter code, code virginia, commonwealth, chapter"
26,75,0.5647758179388441,"Topic 26: wolves, wolf, moose, coyotes, deer","Topic 75: hunting, game, game hunting, game animals, hunting licence"
45,28,0.5326829137774456,"Topic 45: networks, network, ecological networks, interaction, interactions","Topic 28: chemicals, dangerous, substances, dangerous goods, chemical"
252,64,0.6039718601557029,"Topic 252: leopard, leopards, tiger, tigers, carnivore","Topic 64: petroleum, gas, midstream, petroleum industry, petroleum products"
298,28,0.3042160983098165,"Topic 298: pregnancy, fetal, women, pregnant, endometrial","Topic 28: chemicals, dangerous, substances, dangerous goods, chemical"
155,5,0.5219211746449846,"Topic 155: recombination, genomic, gene flow, selection, hybrid","Topic 5: waste, waste management, recycling, hazardous, disposal"
328,89,0.3086516679675976,"Topic 328: jats sub, italic jats, sub, sub jats, men12759","Topic 89: information, access information, access, disclosure, right access"
212,27,0.42034783042930296,"Topic 212: aquatic, riparian, terrestrial, subsidies, pufa","Topic 27: food, labelling, regulations, additives, packaged"
269,97,0.5424806553539538,"Topic 269: marshes, marsh, wetlands, wetland, alterniflora jats","Topic 97: small, enterprises, fund, small medium, medium enterprises"
199,16,0.4636284566636727,"Topic 199: light, artificial light, alan, lighting, light pollution","Topic 16: fishing, fish, commercial fishing, commercial, licence"
408,66,0.2696098852703113,"Topic 408: milk, cows, milk yield, dairy, lt sup","Topic 66: veterinary, veterinarian, veterinary services, veterinarians, registration"
541,25,0.24582140037562208,"Topic 541: carbon, carbon emission, emission, carbon emissions, emissions","Topic 25: disaster, emergency, disaster management, emergency management, disaster risk"
292,97,0.4208923567019453,"Topic 292: care, burying, parents, offspring, burying beetle","Topic 97: small, enterprises, fund, small medium, medium enterprises"
86,59,0.6868851705402007,"Topic 86: psf, plant soil, soil, feedback, feedbacks","Topic 59: cooperative, cooperatives, operatives, societies, members"
68,5,0.3906697732693873,"Topic 68: jats sup, sup, isotope, sup 15, isotopic","Topic 5: waste, waste management, recycling, hazardous, disposal"
658,97,0.4302279254521077,,"Topic 97: small, enterprises, fund, small medium, medium enterprises"
571,37,0.5268656558107943,"Topic 571: resistance, pesticide resistance, case cyp, cyp jats, cyp","Topic 37: heritage, aboriginal, cultural, cultural heritage, islander"
624,27,0.3687393966640024,"Topic 624: jankowski bunting, jankowski, genetic diversity, genetic, bunting","Topic 27: food, labelling, regulations, additives, packaged"
176,44,0.5517104544132033,"Topic 176: occupational, dust, respiratory, jats bold, bold","Topic 44: virginia, chapter code, code virginia, commonwealth, chapter"
248,28,0.4906382767458348,"Topic 248: genome, mb, n50, genome assembly, genes","Topic 28: chemicals, dangerous, substances, dangerous goods, chemical"
569,27,0.620000484804239,"Topic 569: trout, growth, summer, physiological optimum, brown trout","Topic 27: food, labelling, regulations, additives, packaged"
143,68,0.43814924964565577,"Topic 143: mining, reclamation, dumps, coal, disturbed lands","Topic 68: fuels, biomass, biofuels, renewable, scheme"
598,97,0.3033840994845965,"Topic 598: products, product, repairability, ce, repair","Topic 97: small, enterprises, fund, small medium, medium enterprises"
501,44,0.3980963823501636,"Topic 501: thermal, ct jats, critical thermal, ct, frogs","Topic 44: virginia, chapter code, code virginia, commonwealth, chapter"
116,34,0.5573002957605907,"Topic 116: crabs, crab, barnacle, barnacles, shells","Topic 34: agricultural, farmers, purpose act, rural, contribute"
152,28,0.31288522180298317,"Topic 152: color, colour, coloration, morphs, pigmentation","Topic 28: chemicals, dangerous, substances, dangerous goods, chemical"
142,5,0.5189524882177159,"Topic 142: heat, x0d, heat transfer, polymer, screw","Topic 5: waste, waste management, recycling, hazardous, disposal"
186,73,0.5681029428533338,"Topic 186: selfing, mating, pollen, outcrossing, pollen dispersal","Topic 73: model, animals, animal, entry union, consignments"
554,97,0.386450596288338,"Topic 554: koala, koalas, occupancy, drone, horse","Topic 97: small, enterprises, fund, small medium, medium enterprises"
332,27,0.5724125224525396,"Topic 332: endophyte, endophytes, fungal, endophyte communities, host","Topic 27: food, labelling, regulations, additives, packaged"
308,97,0.39036417311603505,"Topic 308: text version, jats pdf, pdf text, book review, book","Topic 97: small, enterprises, fund, small medium, medium enterprises"
44,97,0.479919503642272,"Topic 44: drought, hydraulic, tree, xylem, growth","Topic 97: small, enterprises, fund, small medium, medium enterprises"
158,97,0.4184523929113395,"Topic 158: және, мен, анықталды, thе, бұл","Topic 97: small, enterprises, fund, small medium, medium enterprises"
218,0,0.568411276719904,"Topic 218: arctic, russian, russian arctic, economic, arctic zone","Topic 0: water, water resources, supply, water supply, resources"
522,27,0.41694664856581976,"Topic 522: lt em, em gt, em, lt, gt","Topic 27: food, labelling, regulations, additives, packaged"
50,97,0.38032895519380505,"Topic 50: yield, yield plant, genotypes, cluster, fruit","Topic 97: small, enterprises, fund, small medium, medium enterprises"
340,27,0.426658999275417,"Topic 340: liver, rats, cirrhosis, liver cirrhosis, carbon tetrachloride","Topic 27: food, labelling, regulations, additives, packaged"
157,97,0.5460327802523245,"Topic 157: bird, birds, bird species, richness, landscapes","Topic 97: small, enterprises, fund, small medium, medium enterprises"
412,123,0.4024564079815806,"Topic 412: engine, diesel, fuels, diesel engine, injection","Topic 123: marine, designates area, instrument designates, described schedule, area described"
165,34,0.5852425814220426,"Topic 165: deer, browsing, moose, deer density, earthworm","Topic 34: agricultural, farmers, purpose act, rural, contribute"
237,97,0.5399809413573532,"Topic 237: stability, perturbations, ecological stability, ecosystem, asynchrony","Topic 97: small, enterprises, fund, small medium, medium enterprises"
198,77,0.44228268169984325,"Topic 198: experimental group, pigs, cows, feed, meat","Topic 77: land, crown, lands, fence, crown lands"
164,97,0.5799533958335811,"Topic 164: genomic, hybrid, divergence, phenotypic, plumage","Topic 97: small, enterprises, fund, small medium, medium enterprises"
85,76,0.6299750053591245,"Topic 85: microplastics, plastic, microplastic, plastics, mps","Topic 76: dakota, south dakota, district, south, chief engineer"
505,39,0.4233100236677658,"Topic 505: invasiveness, freshwater, bra, fisk, fisk jats","Topic 39: fishing, iuu, iuu fishing, vessel, fisheries"
163,73,0.5234603305486469,"Topic 163: hair, elements, children, selenium, women","Topic 73: model, animals, animal, entry union, consignments"
388,95,0.4242552912714135,"Topic 388: sex, sexing, sex linked, lamp, italic chd","Topic 95: health, care, ncds, strategic, health care"
250,15,0.16622054484042226,"Topic 250: ukraine, air temperature, air, temperature, territory","Topic 15: eu, union, regulation, fishing, union waters"
147,27,0.5304215104598698,"Topic 147: lions, lion, prey, carnivore, carnivores","Topic 27: food, labelling, regulations, additives, packaged"
73,8,0.7377657940739337,"Topic 73: phage, microbial, plasmid, plasmids, bacteria","Topic 8: land, registration, property, act, court"
341,97,0.30807491295032746,"Topic 341: breeding, arrival, timing, arrival breeding, date","Topic 97: small, enterprises, fund, small medium, medium enterprises"
492,5,0.7375663927757043,"Topic 492: brain, brain size, personality, brains, size","Topic 5: waste, waste management, recycling, hazardous, disposal"
177,76,0.5290022090514571,"Topic 177: sexual, male, males, sexual conflict, female","Topic 76: dakota, south dakota, district, south, chief engineer"
566,59,0.4743844124254761,"Topic 566: fox, red fox, foxes, arctic, red","Topic 59: cooperative, cooperatives, operatives, societies, members"
535,44,0.3778436648000661,"Topic 535: moon, moonlight, lunar, illumination, moon phase","Topic 44: virginia, chapter code, code virginia, commonwealth, chapter"
180,78,0.5738346539403446,"Topic 180: patients, stroke, ah, hypertension, arterial hypertension","Topic 78: investment, investors, investments, economic, investor"
210,5,0.5045998985321771,"Topic 210: circular, ce, circular economy, economy, circularity","Topic 5: waste, waste management, recycling, hazardous, disposal"
463,5,0.39275457157715415,"Topic 463: farmers, climate, climate change, perception climate, climate shocks","Topic 5: waste, waste management, recycling, hazardous, disposal"
433,34,0.5294297963297487,"Topic 433: owls, owl, tawny, italic mice, apodemus jats","Topic 34: agricultural, farmers, purpose act, rural, contribute"
215,37,0.3850454509531914,"Topic 215: jats sub, sub, sub jats, respiration, carbon","Topic 37: heritage, aboriginal, cultural, cultural heritage, islander"
192,59,0.3554392687505606,"Topic 192: sound, acoustic, noise, porpoise, whales","Topic 59: cooperative, cooperatives, operatives, societies, members"
533,27,0.4924449508910476,"Topic 533: herbivores, large herbivores, herbivore, rewilding, large","Topic 27: food, labelling, regulations, additives, packaged"
567,28,0.5890060032144733,"Topic 567: conservation, attitudes, wildlife conservation, conservation education, wildlife","Topic 28: chemicals, dangerous, substances, dangerous goods, chemical"
131,59,0.5069052022208282,"Topic 131: cuckoo, brood, parasitism, egg, cuckoos","Topic 59: cooperative, cooperatives, operatives, societies, members"
